video_id,title,channel_name,total_comments,creator_comments,perception_comments,creator_perception,viewer_perception,perception_ratio,monetization_pressure_mentions,censorship_behavior_mentions,off_platform_diversion_mentions,suppression_mechanisms_mentions
t-AlH_e3m6M,Kendrick & Hip Hop’s Beef with Drake: Round 2 | OLAY & FRIENDS,olurinatti,401,0,1,0,1,0.25,0,0,1,0
t84MM6nZiso,Winter Storm & Liberalism in Texas,midwesternmarx,62,0,0,0,0,0.0,0,0,0,0
tA892U5VcYg,The True Story of the “Lone Survivor”,midwesternmarx,350,0,1,0,1,0.29,0,0,0,1
uLi5lne3T-k,COMMUNISM IS WINNING! | RATHBONE,midwesternmarx,104,0,0,0,0,0.0,0,0,0,0
uwUsxCDq7VE,"The GRAMMYs Finally Got it Right, The Rise of Doechii & Kendrick’s Sweep | OLAY & FRIENDS",olurinatti,227,0,1,0,1,0.44,0,0,1,0
uwXrxhYaAxs,Mamdani Pledges To DESTROY New York,Actual Justice Warrior,1019,0,0,0,0,0.0,0,0,0,0
v_-wUiVtKVE,Debating Sam Seder On Crime,Actual Justice Warrior,1572,1,5,0,5,0.32,0,5,0,0
v_ZW-ioyTNU,"Laverne Cox on Trans Joy, Resistance & Survival | ICONIC INTERVIEW",olurinatti,221,0,0,0,0,0.0,0,0,0,0
vcquD2J462o,Krystal Ball Wants Sydney Sweeney DESTROYED,Actual Justice Warrior,734,0,0,0,0,0.0,0,0,0,0
vjpwKvjmxiw,TYT RAGES At AOC,Actual Justice Warrior,511,0,1,0,1,0.2,0,1,0,0
vr_HvNxUEjM,The (Sad) State of Black Politics | OLAY & FRIENDS,olurinatti,167,0,0,0,0,0.0,0,0,0,0
w33BJ04LqaE,NYPD Illegally Hired CRIMINALS To Be Cops,Actual Justice Warrior,341,0,0,0,0,0.0,0,0,0,0
wJWpjj3AB48,Kendrick vs. Drake: GAME OVER | OLAY & FRIENDS,olurinatti,363,1,0,0,0,0.0,0,0,0,0
wQhkoTny7oI,Socialist Countries Tier List Part 1,midwesternmarx,50,0,1,0,1,2.0,0,1,0,0
wUW-yPF86Ag,Ghetto TRASH Mom ATTACKS High School Girl,Actual Justice Warrior,568,0,2,0,2,0.35,0,1,1,0
waBGDGWMmGU,Hasan Piker Schools Capitalist on Healthcare - Jubilee Middle Ground Reaction,midwesternmarx,65,0,0,0,0,0.0,0,0,0,0
y-X7q5tUH4g,Why People Hate Ja Morant,olurinatti,150,0,0,0,0,0.0,0,0,0,0
yefIunm7Dgs,Is Trump bringing us to war? (Re-cap),Actual Justice Warrior,5,0,0,0,0,0.0,0,0,0,0
zUqo1s2P8zY,Fake Judge FREED Iryna Zarutska's Killer,Actual Justice Warrior,454,0,0,0,0,0.0,0,0,0,0
zbhW36M_QKI,How Women Become Carceral Feminists,olurinatti,562,1,0,0,0,0.0,0,0,0,0
zh1eX7RA7ac,Milton Friedman is a Greedy lil Gremlin,midwesternmarx,62,0,0,0,0,0.0,0,0,0,0
zn8MbXPP1HA,"Eddie Liger Live-stream #9 Cuba, Neo-Marxism , & More!",midwesternmarx,5,0,0,0,0,0.0,0,0,0,0
zpweRxDVxbM,Riley: Date me or you're a bigot,Actual Justice Warrior,14,0,0,0,0,0.0,0,0,0,0
